{
  "schema_version": "1.0",
  "report_id": "e6e302d6-bfa5-40f6-80f6-fbbdd46b3bf3",
  "agent_instance_id": "d407f001-5cb7-427b-899f-3f1267ce918c",
  "sequence": 2,
  "machine_fingerprint": null,
  "agent": { "version": "0.1.0" },
  "collected_at": "2026-10-24T19:54:20Z",
  "os": {
    "id": "ubuntu",
    "version_id": "24.04",
    "pretty_name": "Ubuntu 24.04.4 LTS",
    "id_like": ["debian"]
  },
  "arch": "x86_64",
  "kernel": {
    "running": "6.8.0-147-generic",
    "newest_installed": null
  },
  "reboot_required": null,
  "last_boot_at": "2026-10-24T19:50:00Z",
  "metadata_age_seconds": null,
  "esm_enabled": false,
  "package_manager": { "name": "apt", "version": "2.8.3" },
  "packages": {
    "status": "ok",
    "updates": [
      {
        "name": "base-files",
        "arch": "amd64",
        "installed_version": "13ubuntu10.4",
        "candidate_version": "13ubuntu10.5",
        "repository": "noble-updates",
        "security": false,
        "advisories": []
      },
      {
        "name": "bsdutils",
        "arch": "amd64",
        "installed_version": "1:2.39.3-9ubuntu6.5",
        "candidate_version": "1:2.39.3-9ubuntu6.6",
        "repository": "noble-updates,noble-security",
        "security": true,
        "advisories": []
      }
    ],
    "held": ["base-files"]
  },
  "inventory": {
    "packages": [
      { "name": "apt", "arch": "amd64", "version": "2.8.3" },
      { "name": "base-files", "arch": "amd64", "version": "13ubuntu10.4" },
      { "name": "base-passwd", "arch": "amd64", "version": "3.6.3build1" },
      { "name": "bash", "arch": "amd64", "version": "5.2.21-2ubuntu4" },
      { "name": "bsdutils", "arch": "amd64", "version": "1:2.39.3-9ubuntu6.5" }
    ]
  }
}
