{
  "schema_version": "1.0",
  "report_id": "1963fbbf-3aa8-48a2-8a72-21489f4377c7",
  "agent_instance_id": "d407f001-5cb7-427b-899f-3f1267ce918c",
  "sequence": 1,
  "machine_fingerprint": null,
  "agent": { "version": "0.1.0" },
  "collected_at": "2026-10-24T19:54:09Z",
  "os": {
    "id": "ubuntu",
    "version_id": "24.04",
    "pretty_name": "Ubuntu 24.04.4 LTS",
    "id_like": ["debian"]
  },
  "arch": "x86_64",
  "kernel": {
    "running": "6.8.0-147-generic",
    "newest_installed": null
  },
  "reboot_required": false,
  "last_boot_at": "2026-10-24T19:50:00Z",
  "metadata_age_seconds": null,
  "esm_enabled": false,
  "package_manager": { "name": "apt", "version": "2.8.3" },
  "packages": {
    "status": "ok",
    "updates": [
      {
        "name": "base-files",
        "arch": "amd64",
        "installed_version": "13ubuntu10.4",
        "candidate_version": "13ubuntu10.5",
        "repository": "noble-updates",
        "security": false,
        "advisories": []
      },
      {
        "name": "bsdutils",
        "arch": "amd64",
        "installed_version": "1:2.39.3-9ubuntu6.5",
        "candidate_version": "1:2.39.3-9ubuntu6.6",
        "repository": "noble-updates,noble-security",
        "security": true,
        "advisories": []
      },
      {
        "name": "coreutils",
        "arch": "amd64",
        "installed_version": "9.4-3ubuntu6.2",
        "candidate_version": "9.4-3ubuntu6.3",
        "repository": "noble-updates,noble-security",
        "security": true,
        "advisories": []
      },
      {
        "name": "diffutils",
        "arch": "amd64",
        "installed_version": "1:3.10-1build1",
        "candidate_version": "1:3.10-1ubuntu0.1",
        "repository": "noble-updates,noble-security",
        "security": true,
        "advisories": []
      },
      {
        "name": "gzip",
        "arch": "amd64",
        "installed_version": "1.12-1ubuntu3.1",
        "candidate_version": "1.12-1ubuntu3.2",
        "repository": "noble-updates,noble-security",
        "security": true,
        "advisories": []
      }
    ],
    "held": []
  }
}
